sentence Id,sentence,aspect_term,polarity
1547,xbox live : oo zylon oo is currently online . playing call of duty 4 . playing search and destroy on crossfire . -LRB- xbox live nation -RRB-,['xbox'],['neutral']
1548,found a good article on AARP web site about steve jobs and life long learning :,['steve jobs'],['neutral']
1549,Soundsickness : selena gomez Laughs Off Calling Justin Bieber Her ' Little Brother ' . .,['selena gomez'],['negative']
1550,"I mean , Selena 's cool and all , but I think katy perry should win Best Female Singer .",['katy perry'],['positive']
1551,Attention rest of the world : we get it . You did n't like Bush . You can stop giving barack obama awards for no reason now .,['barack obama'],['neutral']
1552,and as bad as i wan na do a 4 year im really thinking to just take me some psp classes at a community college,['psp'],['neutral']
1553,off top ! lmao sum like that . . but i got some micheal jackson for his sucka ass . . lol we are banging dow foe my thang . .,['micheal jackson'],['negative']
1554,harry potter 7 in max was flipping awesome !,['harry potter'],['positive']
1555,mandy moore Raises Awareness for World Malaria Day : Doing their part to help to raise aware ... . .,['mandy moore'],['neutral']
1556,lakers win kilobite with 7 points . Time to get faded fuck with me at pat o 's 3peat,['lakers'],['neutral']
1557,Time for Saleh To Go ? : Nowhere has the obama administration been more reluctant to embrace the revolutions sweep ... .,['obama'],['negative']
1558,Every girl deserves the romance described in taylor swift 's songs .,['taylor swift'],['positive']
1559,"i doubt i 'm famous enough for this to work , but does anyone have a google wave invite they would n't mind parting with ?",['google wave'],['neutral']
1560,madonna is amazing guys ! Revolver,['madonna'],['neutral']
1561,"kidnap checklist : black gloves , duct tape , black hood , water , cup cakes , sarah palin mask , video camera lol we 're nearby ! Lol",['sarah palin'],['negative']
1562,der_vt only goes on her computer like once or twice a day . we are trying to convince her to get an iphone like us !!,['iphone'],['positive']
1563,fstop23 I hate my iPhone-I realized this . Do I down grade phone and buy ipad or buy new phone ? Hnmmm,['ipad'],['neutral']
1564,"So jealous of the martha stewart audience today !! A Dremel and a couple hundred dollars worth of martha stewart brand gear , gahhh",['martha stewart'],['neutral']
1565,"Lawmakers , Executives Slam obama for Boosting Brazil 's Offshore Drilling - FoxNews.com >> > . >> > oilandgas drillnow",['obama'],['negative']
1566,bieber teambieber justin bieber Pranks Willow Smith On Stage | Disney Dreaming : justin bieber too ... . bieberfever,['justin bieber'],['positive']
1567,Grown accustomed 2 onewildeknight 's charmingly esoteric customs . I wear her marks . He has corseted madonna & Fergy . transtuesday,['madonna'],['neutral']
1568,i like the click effect on the windows 7 task bar that looks exactly like the effect caused by jamming your thumb into an lcd display ...,['windows 7'],['neutral']
1569,Lmao stfu ! I 'm done though blood ! Lol RT afRaaadisiac : fuck you RT kwaneequa : Fuck the lakers ! Just thought I should add that !,['lakers'],['negative']
1570,i so need to hear britney spears right now ... i am feeling tick because i want to hear it so bad,['britney spears'],['positive']
1571,nicolas cage sues former business manager for financial ruin,['nicolas cage'],['neutral']
1572,The problem with harry potter | Arts diary,['harry potter'],['neutral']
1573,HaanaSnow no . google translate would fuck it up . XDD,['google'],['negative']
1574,"congratulations b , you deserve this and much more !!!! britney spears 4ever !!!!!!!!!",['britney spears'],['positive']
1575,Quinnipiac Univ national poll : American voters oppose 47 - 40 percent President barack obama ' is health care reform plan,['barack obama'],['neutral']
1576,nicolas cage getting cast in a voice role is the oddest thing ever to me ... why would anyone want a voice that ... '' unique '' in a cgi film ?,['nicolas cage'],['neutral']
1577,nicolas cage gets freaky in bad lieutenant exclusive clip,['nicolas cage'],['negative']
1578,is pretty high now after finishing 2 bottles of wine.im talking shizzzzzzzzzzzzzzzzzzzzzzzzzzzzzzzzzzzzz . and britney spears sounds awesome,['britney spears'],['positive']
1579,nicholas cage hates uncle sam : the irs has placed a tax lien on nicolas cage ' s real estate holdings ... .,['nicolas cage'],['neutral']
1580,Robert Pattinson To Play Prince Harry ? : The Twilight star will apparently battle it out with harry potter man R . .,['harry potter'],['neutral']
1581,ain nobody think about no damn kim kardashian lol least i ain stunt that ass,['kim kardashian'],['negative']
1582,"anyone who hasnt seen the perez hilton and Cher Lloyd interview watch it ! its hilarious , ive seen it about 4 times and it never gets old < 3",['perez hilton'],['positive']
1583,ew ! gag - no way is like the exact same as quicksand - britney spears : s ?,['britney spears'],['neutral']
1584,Yo Anthony saw you on jimmy fallon have always thought you were great huge fan hope this helps you win brother,['jimmy fallon'],['neutral']
1585,Is Lindsey Graham looking more and more like a RINO ? What do you think ? Sen john mccain in AZ looks like one too ! Could they be family ?,['john mccain'],['negative']
1586,today I officially love my ipad .,['ipad'],['positive']
1587,A Sky News reporter asks if Obama got the Nobel price for making peace with hillary clinton ... I think that even this he do n't deserve,['hillary clinton'],['neutral']
1588,operation flashpoint 2 : dragon rising -LRB- xbox 360 -RRB- - operation flashpoint 2 will mark the long-awaited return of the t ...,['xbox'],['neutral']
1589,Sister madonna Buder made the time cut on the swim ironman . She 's 79yrs old and on the bike-she 's finished 36 roman -LRB- via roadbikeaction -RRB-,['madonna'],['negative']
1590,are you on google wave ? i 'd love an invite ! please !,['google wave'],['positive']
1591,RT xgagamazingx : Wishes lady gaga and Adam lambert would do a song : -RRB-,['lady gaga'],['neutral']
1592,Favorite Juan quote ever : '' You know sometimes it sounds like a church in here ... '' - everyone pauses and hears madonna singing next door -,['madonna'],['neutral']
1593,"can i dress up as lindsay lohan for halloween ? how cool would that be ? a 26 inch weave , black leather jacket , black leggings & a fake cigarette .",['lindsay lohan'],['negative']
1594,fuck yeah i love lindsay lohan,['lindsay lohan'],['positive']
1595,6 : wii rock band 2 standalone guitar,['wii'],['neutral']
1596,i am on google wave . i am so much better than you .,['google wave'],['neutral']
1597,"EVERYBODY HATES selena gomez , AND GUESS WHY SO MUCH HATE , NOBODY WANTS A FAME WHORE !!",['selena gomez'],['negative']
1598,i bought the cutest iphone case from lucky brand :-RRB- it has a peace sign on it !!,['iphone'],['positive']
1599,Snort ! It 's too bad they already announced Herta Müller for the Literature Prize ... I was going to suggest sarah palin .,['sarah palin'],['neutral']
1600,about to go get my tiger woods on real quick . this should be interesting since i haven played in a while .,['tiger woods'],['neutral']
1601,Donald Trump sounds like a complete jacka $ $ on anderson cooper . This mofo bet NOT run for office !!!,['anderson cooper'],['negative']
1602,"'' It does n't matter who you are , where you come from . The ability to triumph begins with you . Always . '' - oprah winfrey",['oprah winfrey'],['positive']
1603,Presidents Cup : tiger woods exacts some revenge in clinching win,['tiger woods'],['neutral']
1604,Omg google sure loves KiSeung !! : -RRB-,['google'],['neutral']
1605,oh and i hate britney spears .,['britney spears'],['negative']
1606,Who knew mandy moore could calm my heart this well ? anxious nervous,['mandy moore'],['positive']
1607,"Was sensational ! This program certainly the best of the best madonna is wonderful , fuck mother fucker . It ´ s cool ! Very cool ! Yeah",['madonna'],['neutral']
1608,"I love your songs , your video with madonna is also very funny .",['madonna'],['neutral']
1609,"she got that good good , she micheal jackson bad , im attracted to her , with her attractive ass ... oooo that is the song man !",['micheal jackson'],['negative']
1610,installed windows 7 on my tp ... running smooth so far ... pretty impressed with a microsoft product after a long time !!,['windows 7'],['positive']
1611,rzen I actually really love the new twitter design ... I really '' got '' it when Veronica mentioned it as a replacement for google Reader,['google'],['neutral']
1612,"thank you , but i already have a stand alone charger for it , but i have n't used it because it does n't say ' made for ipod ' on the box .",['ipod'],['neutral']
1613,"oh , and i heard it 's supposed to rain tomorrow . freaking ' george bush . he ruins everything , including letterman 's marriage",['george bush'],['negative']
1614,i take my kindle to anywhere i go . no need for any bag . i just hold it in my hand . great against a black jacket .,['kindle'],['positive']
1615,my friend has that phone & kindle ... if i could win level26 give away . . boy ! i would show her !!!!,['kindle'],['neutral']
1616,psyching out google wave ; wolfram | alpha offers homework help,['google wave'],['neutral']
1617,hilary swank ' s hair on the cover of marie claire is seriously making me want to go light .,['hilary swank'],['negative']
1618,i love britney spears with every fiber of my being : -RRB-,['britney spears'],['positive']
1619,lmao ! Only fangas that have brains of their own would know what sarah palin first cousin looking like,['sarah palin'],['neutral']
1620,Will Nancy Pelosi save John Boehner and barack obama ? : By Brent Budowsky - 04/13/11 10:28 AM ET Before the roost ... .,['barack obama'],['neutral']
1621,Could anyone tell me ... WHY THE FUCK MY google IS N'T REGISTERING MY PASSWORD ?!,['google'],['negative']
1622,RT craigdfreeman An incredible range when listed like this : ' An Amazing list of all the google products and how ... . .,['google'],['positive']
1623,"justice ! lindsay lohan thinks she can just skip her probation classes , well guess what , judge extended it 1 more year -",['lindsay lohan'],['neutral']
1624,fuckn bitch !!! little shits !!! why do these damn porn things keep following me !!! i dnt wan na see britney spears suck penis !!!,['britney spears'],['neutral']
1625,"lindsay lohan - 23 years old , looks like 53 . drugs + booze + the horrible horrible fish lips = sad",['lindsay lohan'],['negative']
1626,I just took '' You 're Pete Wentz ' Daughter and Your Married To justin bieber . He 's abus ... '' and got : Part 12 ^_^ ! Try it : .,['justin bieber'],['positive']
1627,back from an ace event bideawee where hilary swank teamed up with iams home 4 the holidays adoption campaign . awesome people & big hearts !,['hilary swank'],['neutral']
1628,"i know it is fashionable to hate on lindsay lohan , but i think some of the ungaro collection is nice & indeed , wearable , pasties aside",['lindsay lohan'],['neutral']
1629,"halloween im dressing up as a circus lady . similar to what britney spears is wearing in her video clip , cirus ' im sure no1 though of tht1 : d",['britney spears'],['negative']
1630,windows 7 shows progress bars in the task bar ! how cool is that ? now i do n't have to keep little download/upload windows in the corner .,['windows 7'],['positive']
1631,RT myfavgreen : BTMSykes That 's great Bishop . Is this sent from the Pad ? I 'm loving it . | Co has the ipad playing Scrabble . Go figure ! Ha !,['ipad'],['neutral']
1632,monster - britney spears ♫ ♪ ♫,['britney spears'],['neutral']
1633,That awkward moment taylor swift keeps trying to follow you on Twitter .,['taylor swift'],['negative']
1634,"' nancy , is john boehner hard to manage ? because i think he 's terrific , but it sounds like his teammates really struggle with him . '",['john boehner'],['positive']
1635,ha sure enoff ! you will have 2 help me get scooter to follow me :-RRB- if you dnt mind helping omg britney spears is following me x,['britney spears'],['neutral']
1636,"Belichick looks to shake Josh daniels hand , and he walks away and immaturely and poorly imitates a tiger woods fistpump ... what a jerk off",['tiger woods'],['neutral']
1637,to damn britney spears ... ... ... ... ... ... ... haueoeuhoaeuhaeouhehaiuehaoieaae,['britney spears'],['negative']
1638,gears of war 2 . i miss my xbox live account . i 'd be ripping balls right now . modern warfare two is almost out .,['xbox'],['positive']
1639,i had so much candy on halloween that i went on my wii fit and it said '' damn you gained 4.2 pounds '' just kidding it did not say damn,['wii'],['neutral']
1640,I hate the wsj subscriber firewall . Good thing google finds sites with the story info for free ! freenet,['google'],['neutral']
1641,do n't you love it when you get that '' you have a new follower '' pop-up ? then you realize it 's that britney spears sucking a penis ... assholes,['britney spears'],['negative']
1642,please we want britney spears 3 britneyspears3,['britney spears'],['positive']
1643,"did you tell britney spears giving head to follow me ? i know i 'm no cherise , but you don got ta treat me like that man !",['britney spears'],['neutral']
1644,"watching jimmy carter speak about dedication to habitat_org and '' if i had a hammer '' - not the best pres . , but an inspiring man and example .",['jimmy carter'],['neutral']
1645,The difference between justin bieber and Aaron Carter . Everybody loved Aaron . Nobody likes Justin .,['justin bieber'],['negative']
1646,britney spears 3 is fabulous ha,['britney spears'],['positive']
1647,new super mario brothers . wii to be '' hardest in the series '' : the all famous nintendo power ma . .,['wii'],['neutral']
1648,madonna ' is song ' Revolver ' is one of the greatest in 2009 ! -LRB- Just like Drake 's Forever and some other ... -RRB-,['madonna'],['neutral']
1649,"i installed windows 7 on my system , and guess what ? user unfriendly , so i went back to good old xp . win7",['windows 7'],['negative']
1650,This is the 2nd time i 've tweeted this but nicki minaj 's Super bass is awesome x1000 .,['nicki minaj'],['positive']
1651,top 3 weekly lastfm artists : janet jackson - 64 . britney spears - 26 . paloma faith - 12 .,['britney spears'],['neutral']
1652,now there 's a surprise ! windows 7 sales exceed vista sales by 234 % ! -,['windows 7'],['neutral']
1653,hey I 'm justin bieber :-RRB- I LOVE INDONESIA because there are JUPE and DEPE :D eyaaaeyaaa,['justin bieber'],['negative']
1654,"i 'm sooooooooooo bored . one has had ones ipod taken away :--LRB- good bye my lover , good bye my friend !",['ipod'],['positive']
1655,Congress & barack obama wasting the labors of the people under the pretense of taking care of them . teaparty Express tcot HCR p2 FAIL,['barack obama'],['neutral']
1656,"I love human power ... but , why did google bet $ 1 million on Shweeb ? - .",['google'],['neutral']
1657,ryan seacrest asking Pia to turn around so people can admire her ass on American Idol . '' It 's important to admire the couture '' he '' jokes '' Sad,['ryan seacrest'],['negative']
1658,"lady gaga continues chart reign with '' Born This Way '' , spending sixth week at 1 - . via gaganewsdotcom lauralyne",['lady gaga'],['positive']
1659,not saying that shes better than little kim or lady gaga ... but shes dope . I love dressing up and expressing myself through clothes and If i was in,['lady gaga'],['neutral']
1660,"today was a suck , i had to clean my house ... i used to listen to avril lavigne , mcfly and britney spears ! emilycelia i love you !!",['britney spears'],['neutral']
1661,cnet uk rates iphone worst phone in the world :,['iphone'],['negative']
1662,and i once won a speech contest arguing that george bush was the best option for moderate america . i can argue for anything .,['george bush'],['positive']
1663,isaiah is crazy over call of duty . he has the versions for the xbox 360 and the ds,['xbox'],['neutral']
1664,"the next person that follows me or sends me a message with porn using britney spears name , i will report you and rally hard against this .",['britney spears'],['neutral']
1665,i think hell has frozen over ... i 've installed windows 7 ... ku0dm,['windows 7'],['negative']
1666,"jamming to 3 by britney spears , her concert was amazing this year !!!",['britney spears'],['positive']
1667,the left 4 dead 2 demo is now available to all xbox live gold members . good times thus far .,['xbox'],['neutral']
1668,Otm harry potter and the deathly hallow with p4lloverz tasyasalsabila mayrawidjaya . Marshhha sarahlewhilia and back marni,['harry potter'],['neutral']
1669,"Said obama , '' Circle , circle , dot ... dammit , why wo n't you just tell me ? okay , fine , invade Libya , now tell me -- and no crosses count ! ''",['obama'],['negative']
1670,going back and forth from late night with jimmy fallon to fever pitch with jimmy fallon . I feel like heathaaa_m,['jimmy fallon'],['positive']
1671,"i once had a 4 monitor setup with a portable dvd player and my psp and ds , you have much to learn .",['psp'],['neutral']
1672,when the sex bomb I be going in the bathroom and doing the tiger woods fist pump jobwelldone,['tiger woods'],['neutral']
1673,... and BY THE WAY ... do n't forget ... Loser john mccain has Panamanian Cooties . He was n't injured in ' Nam ; he was disfigured by leeches .,['john mccain'],['negative']
1674,I think she 's a breath of fresh air in the dance pop area . This generation needed a madonna type artist .,['madonna'],['positive']
1675,okay last time ... i 'm just proud of my first podcast !! how i went from mickey mouse club to britney spears to jesus ...,['britney spears'],['neutral']
1676,yay for celebs getting it easy ! a judge has extended lindsay lohan ' s probation even though she showed up late,['lindsay lohan'],['neutral']
1677,joe biden is ruining days all over UNH RT : realpod45 the tech place just said my laptop is completely broken ... I blame joe biden,['joe biden'],['negative']
1678,"duo for my ipod is awesome facebook and twitter same time plus its better than tweetdeck , most of all it was free !!!!!!",['ipod'],['positive']
1679,"you new hair style was a bigger scandal than when lindsay lohan did it ! , i swear !! you didnt wanted to dye your hair anymore ?",['lindsay lohan'],['neutral']
1680,made me feel a little better EAJosh In bed with harry potter . Sounds scandalous .,['harry potter'],['neutral']
1681,"If john boehner & Harry Reid can come to a budget compromise , the NFL players ' union and owners really do n't have an excuse . Imjustsaying",['john boehner'],['negative']
1682,britney spears is truly amazing . idc what anyone says !!,['britney spears'],['positive']
1683,"mac or pc ? a fortune for high-end tech of apple or yeah , i can get a pirated version that works like original windows 7 ? : p",['windows 7'],['neutral']
1684,Diego maradona ' is Argentina in danger of suffering an unthinkable end,['maradona'],['neutral']
1685,its bad bad bad alllll bad :-LRB- :-LRB- this is bad real bad micheal jackson,['micheal jackson'],['negative']
1686,"liking windows 7 so far , installed today on work laptop",['windows 7'],['positive']
1687,AMERICAS : President barack obama ' is push for US healthcare reform heads for a key vote in the Senate .,['barack obama'],['neutral']
1688,"' WE STOPPED GADDAFI ' - barack obama defends action in Libya , says US & allies stopped Gaddafi 's deadly advance .",['barack obama'],['neutral']
1689,So there 's 2 of us ! Lol lakers oh snap ! Where 's kihei_girl my friend !,['lakers'],['negative']
1690,selena gomez is not a FAMEWHORE,['selena gomez'],['positive']
1691,"forget the shipsbaltimore sunwas n't she merely the 12th century because equivalent of britney spears , whose romances . .",['britney spears'],['neutral']
1692,can anyone help me get a google wave invite ?,['google wave'],['neutral']
1693,"lady gaga , you are not respect the country law . Bad move to ask youth in Malaysia to protest for your own benefit",['lady gaga'],['negative']
1694,3 by britney spears lol i love that song lol,['britney spears'],['positive']
1695,playing monster hunter 2nd g on my psp,['psp'],['neutral']
1696,"gucciofficial When are you coming out with an ipad portfolio case ? Your sleeve is great , but I need something that is also functional .",['ipad'],['neutral']
1697,I hate maradona and Argentina .,['maradona'],['negative']
1698,"left for dead two game demo . yeah . it , is exclusive for xbox live gold . : -RRB-",['xbox'],['positive']
1699,"paris hilton Denies Reckless Driving Rumors : I believed paris hilton when she defended herself yesterday , and th ... .",['paris hilton'],['neutral']
1700,NI politicians urged to ' finish journey ' : US Secretary of State hillary clinton has emphasize her commitment t . .,['hillary clinton'],['neutral']
1701,FightingWords : FUCK the lakers ! So when you see me let 's catch a Fade !,['lakers'],['negative']
1702,justin bieber - That One That Can Be Totally Serious at Times And Playful The Next -LRB- :,['justin bieber'],['positive']
1703,obama administration introduce first statement calling UNtop human right to combat discrimination against gays and lesbians around the world,['obama'],['neutral']
1704,np lady gaga love down,['lady gaga'],['neutral']
1705,Do Demi Moore And ashton kutcher 's Human Trafficking Videos Seem A Little Too Cheerful To Anyo ... . frankguillen fb,['ashton kutcher'],['negative']
1706,"Watched Get Him to the Greek . Just got ta say ... russell brand is very hot , has a sexy accent , and an amazing ass . That is all . Good night .",['russell brand'],['positive']
1707,"Michelle Bachmann , like sarah palin , is making the GOP stand up and take notice !",['sarah palin'],['neutral']
1708,is it legal to kill an ipod ? : d,['ipod'],['neutral']
1709,Totally half-assed ... obama Rules Out Land Invasion to Oust Qaddafi as New Explosions Reported in Tripoli - FoxNews.com .,['obama'],['negative']
1710,lindsay lohan is a genius,['lindsay lohan'],['positive']
1711,steve jobs to help Disney turn stores into mini theme parks . : Message Rating 8 -LRB- from 10 -RRB- :,['steve jobs'],['neutral']
1712,"I 'm watching on youtube harry potter puppet pals and it 's the funnies thing EVER and i mean really , FUNNY check it out if you do n't believe me",['harry potter'],['neutral']
1713,"george bush didnt deserve one . and clinton had some other issues . . obama is the 4th pres . to win one . so i say , good for him",['george bush'],['negative']
1714,I see you follow sarah palin and other persons of interest I follow . I believe Sarah is an educated & savvy business person,['sarah palin'],['positive']
1715,"logan is overated the britney spears of heroes , so today 's hero is ... the bear . tweet me your bear facts",['britney spears'],['neutral']
1716,can anyone recommend a good screen capture solution for xbox 360 & a macbook -LRB- is this even possible ? -RRB-,['xbox'],['neutral']
1717,"georgia rule is on television , lindsay lohan is such a slut !! and this just in . . cookie dough poptarts are reallllly good",['lindsay lohan'],['negative']
1718,"That awkward moment when you 're diagnosed with Bieber Fever , and all the doctor can do is prescribe justin bieber music .",['justin bieber'],['positive']
1719,watching the film ' boys do n't cry ' it 's impressive how much they 've made hilary swank look like a boy : -RRB-,['hilary swank'],['neutral']
1720,"Saw it , the only thing that was funny on the show ... nbcsandiego Watch Lady gag & madonna ' is '' SNL '' Catfight NBCSD",['madonna'],['neutral']
1721,This is why we could never be :-LRB- RT CPMusicGroup Fuck the lakers for winning tonight . . Yes all season lakers,['lakers'],['negative']
1722,got ta admit that the justice remix of '' me against the music - britney spears '' is awesome : p,['britney spears'],['positive']
1723,"Even joe biden is n't taking Obama seriously : . - Sorry but , if I know something 's putting me to sleep , I stand up .",['joe biden'],['neutral']
1724,"whilst it would be a shame not to have Messi & co in 2010 WC , it would be funny to see maradona fail & prove he 's not God to Argentanians lol",['maradona'],['neutral']
1725,"alwayspistol williamkristol - nobody wants to here from you , tokyo rove , ck except rinos you gave us obama , now let sarah clean it up for us . .",['obama'],['negative']
1726,i 'm laughing at the new set of pathetic mac commercials - it shows a true fear of the new and excellent windows 7 os .,['windows 7'],['positive']
1727,"3 - britney spears , this song is stuck in my head like crazzzzy",['britney spears'],['neutral']
1728,hilary swank : i let boyfriend 's son see me nude : the actress 's admission in marie claire magazine that her boyfr . .,['hilary swank'],['neutral']
1729,"That must be it . I do n't think he 's funny either . karsh : I totally do n't get russell brand 's appeal . It 's all in the accent , right ? idol",['russell brand'],['negative']
1730,windows 7 is pretty impressive so far .,['windows 7'],['positive']
1731,I love Luna Lovegood she is my favorite character in harry potter .,['harry potter'],['neutral']
1732,harry potter is on ... guess I 'm busy for the next 3hrs ... these movies be long as hell,['harry potter'],['neutral']
1733,d0ntiroCC nigga fuck the bandwagon ass lakers ... FUCK KOBE . .,['lakers'],['negative']
1734,reading the user guide for my brand new awesome camera : canon powershot sd90 . ca n't wait to start taking new photos of 92101 .,['canon powershot'],['positive']
1735,I am currently 2 \ 7th of the way done with the seventh harry potter book . I consider that an accomplishment since I started last night . . : -RRB-,['harry potter'],['neutral']
