sentence Id,sentence,aspect_term,polarity
1,"i agree about arafat . i mean , shit , they even gave one to jimmy carter ha . it should be called '' the worst president '' prize .",['jimmy carter'],['negative']
2,musicmonday britney spears - lucky do you remember this song ? it ` s awesome . i love it .,['britney spears'],['positive']
3,"wtf ? hilary swank is coming to my school today , just to chill . lol wow",['hilary swank'],['neutral']
4,my 3-year-old was amazed yesterday to find that ' real ' 10 pin bowling is nothing like it is on the wii ...,['wii'],['neutral']
5,God damn . That Sony remote for google is fucking hideeeeeous !,['google'],['negative']
6,listening 2 '' 3 '' by ms britney spears cant wait 4 the video on oct . 19 you guys need 2 love her new single also buy her single collection nov . 24 !,['britney spears'],['positive']
7,gerard butler is hot ... 1 . his accent 2 . that romantic movie with hilary swank where he was dead 3 . sex scene in the 300,['hilary swank'],['neutral']
8,"no one likes pe at school . all pupils should have to do it in the traditional way . wii fit is fun but in schools , madness",['wii'],['neutral']
9,izašao je you '' videoteci '' novi harry potter i public enemy : -RRB-,['harry potter'],['negative']
10,3 by britney spears is an amazing song,['britney spears'],['positive']
11,"people whose reactions I 'd appreciate this morning : bill clinton 's , hillary clinton ' is ... george bush 's -LRB- latter for completely difference reasons -RRB-",['hillary clinton'],['neutral']
12,NowPlaying lady gaga - let love down,['lady gaga'],['neutral']
13,The obama domestic genocide hug .,['obama'],['negative']
14,"Paramore , incubus , justin timberlake , a7x , the strokes , motley crue pilih yg mana yaah bingung cc buckupshow",['justin timberlake'],['positive']
15,okay maybe just a little shocked xD omg nicolerichie the madonna fans are outraged at what you did,['madonna'],['neutral']
16,he might have got the nobel prize just for not being george bush,['george bush'],['neutral']
17,"People i followed today '' Omarion , Natalie Nunn and any PAST BGC cast , Chingy and perez hilton '' what a list of Wackness",['perez hilton'],['negative']
18,tomorrow we have art class ! love it ! lsning to britney spears - piece of me,['britney spears'],['positive']
19,Waitrose dumps Fox News in protest over -LSB- Glen Beck -RSB- remarks about barack obama,['barack obama'],['neutral']
20,"downloaded blacksn0w for my iphone . the jailbroken features are cool , but the bugs and connection problems are n't worth it .",['iphone'],['neutral']
21,nicki minaj has brought back the female rapper . - really ? nicki minaj is the biggest parody in popular music since the Lonely Island .,['nicki minaj'],['negative']
22,my day off after a wedding consist of wii zelda and chinese food . i feel like i 'm in jr high . this rocks !!,['wii'],['positive']
23,7 inch touch screen 2 din in dash car dvd player with television bluetooth gps ipod function dual zone szc1085 : o . .,['ipod'],['neutral']
24,"do n't get me wrong , i am a huge obama supporter but it feels forced or like an '' at least you 're not george bush award ''",['george bush'],['neutral']
25,FF MarkieAi Likes animals . Hates spiders . Hates charlie sheen . Likes cookies .,['charlie sheen'],['negative']
26,ESPN Soccer Net News Ardiles backs maradona for World Cup glory,['maradona'],['positive']
27,There 's a firefighter in my class who looks just like anderson cooper but buffer and supposedly straight . notcomplaining,['anderson cooper'],['neutral']
28,-LSB- happy birthday git * git ! -RSB- ily ! ... some reason im very tired ! but today was really fun ! :-RRB- ugh my ipod died !,['ipod'],['neutral']
29,"`` SkyJacquie : Is everyone happy jt is back as England Captain ? '' NO ! It 's a farce but that 's England . Capello , another expensive FA failure",['jt'],['negative']
30,omg !! google wave is amazing !!! olo worms plotting stuff in real time . we could meet up in person . . but we all hate each other .,['google wave'],['positive']
31,barack obama and John McCain clash over Afghanistan strategy : barack obama reacted angrily after John McCain a . .,['barack obama'],['neutral']
32,do you know how to convert youtube videos to psp compatible ones through linux command ? thank you in advance : -RRB-,['psp'],['neutral']
33,`` FrameMaker has detected a serious error and must quit . '' So how long has sarah palin been writing code for Adobe ?,['sarah palin'],['negative']
34,hilary swank as amelia earhart is actually pretty great casting .,['hilary swank'],['positive']
35,they even have red costumes on like britney spears,['britney spears'],['neutral']
36,psp is being a brat with text . can someone add some writing on something for me right quick ? does n't need to be pretty .,['psp'],['neutral']
37,ABOVE THE RIM : some mean basketball but misses the layup with hammy acting & a script that 's the equivalent to shaq 's art creation,['shaq'],['negative']
38,The dave matthews Band is so damn good . Give me the Chili Peppers and dave matthews Band and I 'm set for a very long while . RHCP DMB,['dave matthews'],['positive']
39,press start : the faces of ' ballad of gay tony ' ; wii update woes extract not available .,['wii'],['neutral']
40,i love bad romance and fashion and 3 by britney spears i love you both lady gag too girl ! her concerts r better than the record !!,['britney spears'],['neutral']
41,Video : serena williams gets x-rated for new tennis game ad ! .,['serena williams'],['negative']
42,"I love anderson cooper ; he is so sensible , honorable and reliable as always . ac360",['anderson cooper'],['positive']
43,shorty like a melody in my head that i keep singing like la la la everyday like an ipod stuck in replay :-RRB- love that song,['ipod'],['neutral']
44,bought one of those rechargable iphone backup battery packs ... no more fear : - -RRB-,['iphone'],['neutral']
45,". probably the most insightful , eloquent , and intelligent interview i 've ever seen . russell brand an intellectual ? damn",['russell brand'],['negative']
46,~ I am an ' Independent Thinker ' and President R . Reagan was a great president . ... I support sarah palin .,['sarah palin'],['positive']
47,"-LSB- gwaveblogs -RSB- ultimate list of google wave gadgets and tools - google wave , google wave extension , google wave gadge ...",['google wave'],['neutral']
48,Rumors Swirl About Biden Sleeping During Obama Speech : Vice President joe biden was caught with his eyes closed ... .,['joe biden'],['neutral']
49,omg what has the world come to !? they sang britney spears !!!! awful !!!! :,['britney spears'],['negative']
50,"good to see britney spears the top of the charts again , she needs a break i think , but i hope she can handle the success this time . .",['britney spears'],['positive']
51,best joke of the day : justin bieber is gay : D,['justin bieber'],['neutral']
52,"Guy Ritchie has revealed he has struggled to cope with his divorce from madonna , and admits he still loves her .",['madonna'],['neutral']
53,"wow , lindsay lohan is looking like garbage . what 's she doing to herself ?",['lindsay lohan'],['negative']
54,- this is sad because i actually love lindsay lohan ... what happen ????,['lindsay lohan'],['positive']
55,I sure would love to meet the guy who created the first computer . . bill gates brother . . lol,['bill gates'],['neutral']
56,you doing police training on 7pm project last night was funny shit . you are a funny bugger . good luck with iphone,['iphone'],['neutral']
57,LMAO i know !! i dnt like harry potter he 's so English !! hehehe its raining here too SMDH,['harry potter'],['negative']
58,"i love britney spears . yes , i said it .",['britney spears'],['positive']
59,"e ainda : oh novo clipe do the all american rejects - '' i wan na '' , bandahori , dionne bromfield , britney spears , beyonce e lady gag",['britney spears'],['neutral']
60,"celeb rumors update ! , hilary swank wants a baby -",['hilary swank'],['neutral']
61,Fox : High-Profile Conservative Group Files Lawsuit Against obama Administration Over Health Care Waivers .,['obama'],['negative']
62,"i love harry potter , but i have to agree with anderson . feminism is not a leading theme in the series ...",['harry potter'],['positive']
63,"ahH Harvey why would you ever want to kiss ryan seacrest ass ? i hate ass-kissers , don scoop that low TMZ",['ryan seacrest'],['neutral']
64,How could barack obama get that Nobel Price ! His preach about a world without nuclear weapon is just pure rhetoric !,['barack obama'],['neutral']
65,i don think any of britney spears ' new music can even be classified as singing ... it 's all computerized !,['britney spears'],['negative']
66,really liking the new britney spears and mj songs : -RRB-,['britney spears'],['positive']
67,"she deserves a NPP Thank you Secretary of State hillary clinton , for helping us resolve the feud ! =",['hillary clinton'],['neutral']
68,woohoo . just got my google wave invite . thank you toddramsey .,['google wave'],['neutral']
69,"This is bad , real bad ... micheal jackson ...",['micheal jackson'],['negative']
70,"Thank you President obama for passing healthcare reform ! with out extension to 26 , I 'd have no healthcare . heathcarereformbirthday",['obama'],['positive']
71,- 11/07/09 : xbox 360 men 's sleep shorts ? yes please . so much stuff at the tucson comic-con .,['xbox'],['neutral']
72,"My last 3 downloads were Good Charlotte , katy perry and Adele . I think I may be turning into a 13 year old girl . Got ta buy some lip gloss .",['katy perry'],['neutral']
73,Photo : lovelyasadove : I do n't like lady gaga at all ! She is a true devilworshiper ! I just do n't like her ! I 'm ... .,['lady gaga'],['negative']
74,"do n't know if anyone is doing it , but google wave seems to be a good place for newsrooms to collaborate in real-time for elections .",['google wave'],['positive']
75,new post : wii perfect shot gun -LRB-,['wii'],['neutral']
76,I remember when i used to make micheal jackson jokes on the phone with bleahr ... Ahhhh those where the good days ...,['micheal jackson'],['neutral']
77,kraima I thought all the micheal jackson faces were going to melt plucka - lucky one was a Plastic Surgeon ... ha !!!,['micheal jackson'],['negative']
78,listening to britney spears ' 3 ! awesome song . sounds like an orgasm !,['britney spears'],['positive']
79,"Former AMA Presidents Offer Second Opinion : President barack obama pitched his health care reform plan , again , . .",['barack obama'],['neutral']
80,"i realize i can do all that if i jailbreak it , but i should n't have to do that and suffer as an honest iphone user .",['iphone'],['neutral']
81,i HATE harry potter,['harry potter'],['negative']
82,"Rick Ross feat . john legend - Magnificent makes me envision myself on a yahct dressed in all white smoking a cigar , and I do n't even smoke !",['john legend'],['positive']
83,Reading right now - ' martha stewart Weddings ' chapter on flowers . I 'm in creative inspirational heaven ! - What are you reading right now ?,['martha stewart'],['neutral']
84,britney spears bikini pictures are not bad,['britney spears'],['neutral']
85,was lindsay lohan ' s ungaro collection really as bad as everyone said - by josh partner - slate magazine,['lindsay lohan'],['negative']
86,- iphone day ! double epic woohoo woohoo ! spint it has been a good run . thanks,['iphone'],['positive']
87,"justin timberlake . Get the N'sync boys back together and marry me . Please . Also , grow your hair curly again and die it blonde . Thanks < 3",['justin timberlake'],['neutral']
88,I just woke up from a dream in which I was shopping with madonna & she tried to set me up with Seth Rogen .,['madonna'],['neutral']
89,aaaaaaaand the lindsay lohan debacle continues ...,['lindsay lohan'],['negative']
90,having a good wii,['wii'],['positive']
91,lindsay lohan ' s day in court | gossipcenter - celebrity gossip and ... : breaking news ; hottest stories ; more gossip . courteney cox : & . .,['lindsay lohan'],['neutral']
92,How to make your presentations enthralling and packed with impact : Deliver them like steve jobs :,['steve jobs'],['neutral']
93,if this retarded ellen degeneres look alike bitch don get the fuck up out my mentions . all hell is gon na break loose .,['ellen degeneres'],['negative']
94,Mmmm & I forgot how much I love having a ipad . Even if it is slightly pointless !,['ipad'],['positive']
95,Magical steve jobs to help Disney stores become mini theme parks,['steve jobs'],['neutral']
96,say what you will about hillary clinton . the woman has a gift for retaining info and is a master interviewee . watching her on '' amanpour . '',['hillary clinton'],['neutral']
97,ill order a bitch with a kim kardashian ass trina attitude and monica face is that on the menu ?,['kim kardashian'],['negative']
98,I won 6 achievements in harry potter,['harry potter'],['positive']
99,britney spears releases '' 3 '' and a year and a half ago was just a hot mess and we say legend . gag creates art . we call her dude ?,['britney spears'],['neutral']
100,"xbox + $ 100 gift card for $ 200 this weekend ! hello , beatles rock band :",['xbox'],['neutral']
101,mandy moore nude video Check out the latest mandy moore nude sex videos and other funny videos from ... mandy moore fansite with latest picture,['mandy moore'],['negative']
102,A leopard never changes his stripes . -LRB- al gore -RRB- WisdomTweets .,['al gore'],['positive']
103,noul album ` fame : the monster ` a lui lady gag va fi lansat in 24 nov in aceas zi cu cel a lui britney spears www.cr15t1.webs.com/blog.htm,['britney spears'],['neutral']
104,"gossip girls >> lindsay lohan : post-court pampering : after spending her morning in court , l . .",['lindsay lohan'],['neutral']
105,"StatusLive Lol I never had love for the lakers yo . My nigga C10music is a die hard Laker fan , and a even more die hard Kobe fan . . SMH .",['lakers'],['negative']
106,"66 . my favorite singers are The Pretty Reckless , taylor swift , Selena , Demi , Miley , Short Stack and Plumb -LRB- yes , Plumb is a band -RRB-",['taylor swift'],['positive']
107,McCain was for Gadhafi before he was against him : I noted earlier that Sen. john mccain has taken a strange ... . is US,['john mccain'],['neutral']
108,"vista sold more pcs than windows 7 did : ironically , it was the computer manufacturers who did best in feb . 2007 . .",['windows 7'],['neutral']
109,Sister madonna Buder made the time cut on the swim ironman . She 's 79 yo & on the bike-she 's finished 36 roman events .,['madonna'],['negative']
110,thanks for google wave jillglavan . i am successfully as confused as you .,['google wave'],['positive']
111,"we don do the soulja boy 's and crime mobs , we do the j-lo 's and britney spears",['britney spears'],['neutral']
112,lol . nahh . if that 's the case then it 's a lousy application . it would n't even let me log in and hanged my ipod sia . t_t,['ipod'],['neutral']
113,There 's also the theory that the real steve jobs is actually the turtleneck he wears . The body is a decoy . runita,['steve jobs'],['negative']
114,Demand justin bieber in Lisbon at Eventful - .,['justin bieber'],['positive']
115,Born This Way - lady gaga : ... .,['lady gaga'],['neutral']
116,i have my doubts that that 's lindsay lohan ...,['lindsay lohan'],['neutral']
117,nicolas cage drowning in debt - bodog beat,['nicolas cage'],['negative']
118,im a micheal jackson lover hah . xD -LRB- via ASiAbAbbi -RRB- < ~ mee too adorebrittanyox Meee Three ! Have you guys saw My wallpaper : -RRB-,['micheal jackson'],['positive']
119,A warm welcome to hillary clinton ! Max,['hillary clinton'],['neutral']
120,me too . maggiedana yankee kindle ? mariblaser as soon as they come out with that kindle that smells like a book ! they got me ! writechat,['kindle'],['neutral']
121,mlbpulse angels errors more contagious than lindsay lohan genital warts at promises .,['lindsay lohan'],['negative']
122,misskish0h9 BarOfTheDay : my motto get money that 's it/mastering the green game like tiger woods an ...,['tiger woods'],['positive']
123,"on this day in 2002 , former president jimmy carter won the nobel peace prize . history",['jimmy carter'],['neutral']
124,"In the time Ive spent waiting for a special someone to do their blackhair , I could 've translated all the harry potter books into Latin .",['harry potter'],['neutral']
125,Fuck the lakers LOL . . Teamceltics,['lakers'],['negative']
126,downloaded it . like it ! 4 record did n't like amy song britney spears & risque 3 ; to debut atop hot 100,['britney spears'],['positive']
127,-LSB- cnn -RSB- -LSB- crime -RSB- lohan told next violation means jail : lindsay lohan will be heading to jail if a judge . .,['lindsay lohan'],['neutral']
128,Kids admire steve jobs more than Oprah and the Olsen twins Ask your kids who they look up to kids apple,['steve jobs'],['neutral']
129,RT : DaKiDJAY17 '' FuckYeahAwny hahaha NEVER ! Mine like kim kardashian ... yours like Khloe ... O '' damn i don even wan na play anymore :-LRB- ha,['kim kardashian'],['negative']
130,Extremely random snow day . Win . Thanks charlie sheen !,['charlie sheen'],['positive']
131,so dumb I had to RT it : box Signed by sarah palin Will Set You Back $ 1.1 Million -LRB- Plus Shipping -RRB- -,['sarah palin'],['neutral']
132,'' WeezyDaGreat : lady gaga concert tonight anybody ??? '' < -- your going ? Lol,['lady gaga'],['neutral']
133,So its okay 4 George Bush to do what evah he wants & asking questions is unpatriotic-but obama is supposed 2 state every move in advance-libya,['obama'],['negative']
134,"ms dhoni has emerged as my hero ! Honest , confident and to top it all totally humble . Kudos !",['ms dhoni'],['positive']
135,hi ! i think you look like lindsay lohan ...,['lindsay lohan'],['neutral']
136,- lol thats bit harry potter like : ' D : P,['harry potter'],['neutral']
137,did n't want to get wet so i read all the newspapers on my laptop this morning . shame the kindle is disappointing .,['kindle'],['negative']
138,"hambling242 you love lady gaga , well I was going to follow you .",['lady gaga'],['positive']
139,"i know it 's anecdotal , but the kindle application , stanza and classics are some of the most popular apps i see",['kindle'],['neutral']
140,trying on '' dress clothes '' for work ughhh booty n thighs hatin man aint shit open ! Grrrr now I 'm mad real mad micheal jackson,['micheal jackson'],['neutral']
141,okay i will be a little more reasonable ... Comparing Keyshia Cole to alicia keys is like comparing Lloyd to Chris Brown,['alicia keys'],['negative']
142,download britney spears '' kill the lights '' . i 've loved her since day one & it 's definitely one of her best songs ever,['britney spears'],['positive']
143,just woke up from a dream about me and lindsay lohan going shopping at target . wtf,['lindsay lohan'],['neutral']
144,- I saw FSM Pres Mori on 10/1 . He 'd met w/Sec . hillary clinton who said US willing to expand USAID & Peace Corps in Pacific Islands .,['hillary clinton'],['neutral']
145,"'' They did n't know how I feel inside , through my smile I cry '' - alicia keys '' Caged Bird ''",['alicia keys'],['negative']
146,I love google ! as a whole with all its services,['google'],['positive']
147,love watching the Cowboys play especially when they WIN . Now watching harry potter . ...,['harry potter'],['neutral']
148,alicia keys '' That 's how strong my love is '' just made me tear up a little bit .,['alicia keys'],['neutral']
149,i wonder what the freak is wrong with the zune software like seriously they need to get this stuff straightened out . damn you bill gates !,['bill gates'],['negative']
150,selena gomez stoptheselenahate :-RRB- because I 'm a selenator and I ADORE Justin and miley cyrus : L ! so STOP THE HATE,['miley cyrus'],['positive']
151,lindsay lohan -- late for a very important date ! -,['lindsay lohan'],['neutral']
152,"mm lady gag - starstruck , britney spears - radar , madonna - celebration rihanna - te amo shakira - did it again pixie lott - mama do",['britney spears'],['neutral']
153,Yumagk21_1 Apple Survey - Are Apple products any good ? ipad sucks ? apple .,['ipad'],['negative']
154,im totally on twitter on my wii right now ... im super cool :3,['wii'],['positive']
155,"lindsay lohan ' s love shot down ! : e ! online but where there 's a broken heart , there 's a twitter acco . .",['lindsay lohan'],['neutral']
156,"Oh , please do n't change - it 's as good as the '' whips-n-chains , '' tatooed sarah palin avatar pimped at the other end of the spectrum",['sarah palin'],['neutral']
157,she means that our face like lindsay lohan : ha what is she mean by judge us as a mean girl ?,['lindsay lohan'],['negative']
158,Finished reading all harry potter books ! They were even more awesome then the movies ! : D,['harry potter'],['positive']
159,It 's official . FedEx arrived and I now have 128GB of ipad . Now to fix that and turn Lovely Wife 's frown into a smile . fb,['ipad'],['neutral']
160,"Focus on al-Qaeda , not Taliban : An official says President barack obama is prepared to accept some Taliban invo . .",['barack obama'],['neutral']
161,William Bradley : Obama 's Biggest Problems Still Lie Abroad : President barack obama has no shortage of nasty cri ... .,['barack obama'],['negative']
162,gagafanforever8 ahh ... you love lady gaga,['lady gaga'],['positive']
163,should twitter be like wii and have a time out window pop up that tells you to go outside and stretch your legs ?,['wii'],['neutral']
164,is this for the ipod touch or phone . dino i have a friend with a phone that thimks jailbreaking is illegal .,['ipod'],['neutral']
165,words ca n't express how much i loathe nicolas cage .,['nicolas cage'],['negative']
166,"lol forever . You guys put on a great show ! Stephen Colbert sang ' Friday ' on jimmy fallon . They raised $ 86,000 for Donors Choose . awesome",['jimmy fallon'],['positive']
167,xbox live : chaos mastermx is currently online . playing halo waypoint . watching videos . -LRB- xbox live nation -RRB-,['xbox'],['neutral']
168,"hoosierbeergeek england - staying in Brighton on the sea front -LRB- beach -RRB- , my office is in burgis hill ... google it , its pretty awesome",['google'],['neutral']
169,is an indian version of lindsay lohan . in the worse way . suck it samronson,['lindsay lohan'],['negative']
170,i love demi lovato ... and i really think teenagers in Malaysia should look up to her . she 's a Really good example SoMalaysian staronline,['demi lovato'],['positive']
171,"developer : phone can rival nintendo ds , sony psp for games ...",['psp'],['neutral']
172,how do you like settlers of catan for the xbox ?,['xbox'],['neutral']
173,and jimmy fallon and taylor hicks lmao,['jimmy fallon'],['negative']
174,"yeah this is true , i like windows 7 ... i just hate microsoft 's marketing department ... ; -RRB-",['windows 7'],['positive']
175,tiger woods follow through in 18th fairway looked like Larry Bird 's last shot in 1988 3-point contest . Replay after replay . golf,['tiger woods'],['neutral']
176,"Dame Maggie ' too frightened ' of stage after cancer battle , will ' stagger through ' last harry potter films .",['harry potter'],['neutral']
177,hilary swank : i let boyfriend 's son see me nude : but her revelation that she goes nude in real life -- in fro . .,['hilary swank'],['negative']
178,"Awesome ! KenTremendous : jimmy fallon is doing the coolest . show in late night , and here 's proof : . . '' this is f ** king great",['jimmy fallon'],['positive']
179,are you bothered by the lack of a proper menu with windows 7 ? here 's the solution .,['windows 7'],['neutral']
180,"was floored by the pilot on food stamps in the michael moore movie . sully should make more money than britney spears , right ?",['britney spears'],['neutral']
181,My right boob is like sarah palin ; always going rogue .,['sarah palin'],['negative']
182,oh justinbieber and taylorswift are in the same country ?? : o that 's amazing ! I wish I were british ... ha,['taylorswift'],['positive']
183,would you still like to borrow the kindle ?,['kindle'],['neutral']
184,i 've been surfing the google wave lately . i had high hopes but they have been dashed . perhaps it will redeem itself . googlewave,['google wave'],['neutral']
185,holy shit ! i would fucking kill to see hillary clinton ...,['hillary clinton'],['negative']
186,good list ! i love my wii fit : -RRB-,['wii'],['positive']
187,I love nikki Minaj ! She 's the black lady gaga but even better !!! I love you girrrlll,['lady gaga'],['neutral']
188,Where the hell did the Opinions section of my Voice issue go ? All I want to do is read witty articles and something to do with harry potter .,['harry potter'],['neutral']
189,"SonjaaRenee fuck ipad , people that follow me . fuck ipad",['ipad'],['negative']
190,"nowlistening britney , Rihanna , JLo feat Pitbull - Against the floor ... Love the vibe of this song ... . ''",['britney'],['positive']
191,as of britney spears ??!!! you know you rock her songs !!! lol -LRB- it 's cool -RRB-,['britney spears'],['neutral']
192,Something I came across reading strobist . harry potter like motion images . Check it out . Very cool :,['harry potter'],['neutral']
193,"i hate the lame lady gaga quizes on facebook . they are all the same . if i make one , that is really hard , will y' all take it ?",['lady gaga'],['negative']
194,my sister does n't believe i just kissed britney spears excellent :--RRB- will you ?,['britney spears'],['positive']
195,ha . . fucking iphone always corrects the wrong fucking words,['iphone'],['neutral']
196,"musicmonday my own way - honor society , everything youre not - demi lovato , tiffany blews - fall out boy , blur - britney spears : -RRB-",['britney spears'],['neutral']
197,fucking lakers only have black people playing on their team !! black people are good at basketball !! no wonder they are winning ! LETS GO KINGS,['lakers'],['negative']
