sentence Id,sentence,aspect_term,polarity
4607,your welcome so your favorite song -LRB- mine is piece of me - britney spears -RRB- -LRB- or party in the usa-miley cyrus -RRB- :-RRB- :-RRB- :-RRB- :-RRB- :-RRB- :-RRB- :-RRB- :-RRB- : !!,['britney spears'],['neutral']
4608,Democrats love Bob Dole . Americans love sarah palin .,['sarah palin'],['neutral']
4609,minivanblues Apple Survey - Do apple products rule your world ? ipad sucks ? apple .,['ipad'],['negative']
4610,nerdtweet I love harry potter . I 'll watch this all day before anything else,['harry potter'],['positive']
4611,SENATOR john mccain MANAGES COLLOQUY ON HEALTH CARE REFORM -LSB- PART 3 ... : Sex Education does not necessarily entai ... .,['john mccain'],['neutral']
4612,lindsay lohan ' s ex would have been a stylish guy !! if she were n't a girl !! hehehe !! check out the dior home jeans !!,['lindsay lohan'],['neutral']
4613,The lakers suck !!!!,['lakers'],['negative']
4614,justin bieber CANT HAVE SEX UNDER THE COVERS BECAUSE HE 'S FUCKING CLAUSAPHOBIC . LOL . However the hell you wan na spell that .,['justin bieber'],['positive']
4615,Smoking up some weed does not make you a criminal -- just ask barack obama .,['barack obama'],['neutral']
4616,"omgg ! i just got spammed by britney spears ! - minus the luxury , of course . lol funny . shame on me . boys will be boyz !",['britney spears'],['neutral']
4617,"i can honestly say i never liked britney spears , even before all the drama . is there even a point to this song ?",['britney spears'],['negative']
4618,last day to win a kindle ! share the most important leadership trait for an automatic chance to win :,['kindle'],['positive']
4619,RT TheLoveStories : Always believe in God because there are some questions that can not be answered by google . TLS,['google'],['neutral']
4620,"celeb rumors update ! , hilary swank : ` i want children ' -",['hilary swank'],['neutral']
4621,khloe kardashian Steps into Kourtney 's Louboutin Sandals : Hot and sexy Kardashian sisters are famous personaliti ... .,['khloe kardashian'],['negative']
4622,picked up a lg 32 '' 1080p lcd set for the bonus room . the wii looks good in hd !,['wii'],['positive']
4623,$ 10 coupon : dj hero renegade edition jay & eminem wii $ 189.99 : dj hero renegade edition for nintendo wii on . .,['wii'],['neutral']
4624,i 've used a kindle only a bit and found its navigation far from simple . kindle book prices are outrageous too !,['kindle'],['neutral']
4625,"lots talk about the Expendables sequel . . Sly not directing , and bigger roles for Bruce Willis and arnold schwarzenegger ? Fingers crossed !",['arnold schwarzenegger'],['negative']
4626,i love britney spears such an idol : -RRB-,['britney spears'],['positive']
4627,So awesome - richard dawkins hates sarah palin . I love him .,['sarah palin'],['neutral']
4628,Ed Harris to play john mccain in HBO 's ' Game changes ' - What do you think ? .,['john mccain'],['neutral']
4629,Khloe and Lamar premieres tomorrow ! Is it me ? khloe kardashian is NOT very attractive . her RING is though lol,['khloe kardashian'],['negative']
4630,"also 4 iphone . its a voice recognition application 4 b berry . you speak , it types . use 4 text , email , twitter , book , you name it . its awesome",['iphone'],['positive']
4631,Is getting hacked off with wrkn all hours god sends & not getting any recognition 4 it from a certain somebody < -- bill gates ?,['bill gates'],['neutral']
4632,lady gaga -LRB- lady gaga -RRB- taunted by burgers . celebrity,['lady gaga'],['neutral']
4633,ShidItsMars the lakers Finals was annoying as fuck . Byron Scott is ridiculous ...,['lakers'],['negative']
4634,"Actually I love micheal jackson , Kim Kardashian and daddy . They are very successful people who are inspirational .",['micheal jackson'],['positive']
4635,"i feel like i should start watching or at least learn a lot more about it . i love playing fifa ' 10 on xbox , so that 's a start !",['xbox'],['neutral']
4636,follow me-uncle cracker . much better than britney spears . : d,['britney spears'],['neutral']
4637,"sorry guys , do n't like miley cyrus . . she dress like a prostitute . . and all i see on Tumblr is : miley miley miley",['miley cyrus'],['negative']
4638,i actually quite like lindsay lohan ' s fashion line . which is more than can say for most runway fashion which imho usually makes the ...,['lindsay lohan'],['positive']
4639,"musicmonday 3 - britney spears , no way - lady gag",['britney spears'],['neutral']
4640,MM madonna - Say Goodbye ... the video was dope too,['madonna'],['neutral']
4641,"Shocked by kim kardashian sex tape video , posted right here : . OMG shocked !!",['kim kardashian'],['negative']
4642,"ohh yeah , love them about as much as i love britney spears ! * growls *",['britney spears'],['positive']
4643,ThatWouldBeAwesome if the lakers hit that three-peat this year,['lakers'],['neutral']
4644,_ Melooo wish you would n't hate on harry potter so much . . Just because you ca n't do magic sheesh,['harry potter'],['neutral']
4645,kesovega Apple Survey - All Apple products Stink ? ipad sucks ? freebies .,['ipad'],['negative']
4646,Cuba 's Fidel Castro hails barack obama ' is Nobel peace prize,['barack obama'],['positive']
4647,Caught madonna ' is Like a Virgin video on television tonight & realized I work with people that were n't even born when that song was out . Scary !!!,['madonna'],['neutral']
4648,i do n't like defining myself . i just am ~ britney spears,['britney spears'],['neutral']
4649,"sweet , face/off is on . best travolta/cage movie . also nicolas cage looks badass with a mustache !",['nicolas cage'],['negative']
4650,now listen again to the cd on my ipod à bit more relaxed no clock ticking ... still strange 30 minutes ago i heard the songs live ...,['ipod'],['positive']
4651,"mariah carey and Nick Cannon Reveal Newborn Twins ' Names : Filed under : Celebrity Baby , Music News , mariah carey , ... .",['mariah carey'],['neutral']
4652,"Caddies looking like real Giants : The Associated Press Fittingly , the caddie for tiger woods wore No . 24 . Not s . .",['tiger woods'],['neutral']
4653,"I watched your Letterman appearance with madonna today on You TubeNobody does that anymore , everyone 's so well behaved shame",['madonna'],['negative']
4654,If Chris Brown had beat up a porn star/unknown/gold digger/escort would we have cared ? charlie sheen did & the world thinks he 's Winning,['charlie sheen'],['positive']
4655,musicmonday britney spears - heaven on earth,['britney spears'],['neutral']
4656,Just saw a commercial with Levi Johnston . Absolutely insane . I wo n't post the commercial out of respect for sarah palin but I 'm disgusted .,['sarah palin'],['neutral']
4657,"engleesh tweeter is like dead chicken no use after 10 momentoes , english fuck tweeter down so quick , like pervert on a paris hilton jardin",['paris hilton'],['negative']
4658,fantastic cover of 3 by britney spears,['britney spears'],['positive']
4659,releaselog | rlslog.net '' new super mario brothers eur wii - ind : if you are a wii owner i am sure you have been wait . .,['wii'],['neutral']
4660,Need some advice ... I have an asus notebook that is awesome but I 'm wondering if an ipad might suit everyday needs better ... Opinions ?,['ipad'],['neutral']
4661,shakira could n't even afford real mud to writhe around in when Wherever Whenever came out . Poor little egg .,['shakira'],['negative']
4662,NEWS . REAL . TIME Historic boost to barack obama ' is health reforms after key Republican 's support : On . .,['barack obama'],['positive']
4663,awwwww shit niggz just put tekin 6 in the ps3 brb unless i win then im taking ngga bread bt yall might see a tweet sayini lost my psp money,['psp'],['neutral']
4664,"ashley , please do n't be like britney spears .",['britney spears'],['neutral']
4665,russell brand is n't as attractive with a clean face .,['russell brand'],['negative']
4666,"lady gaga Please follow me diva ? , you are amazing lady gaga , i love you ♥ Follow me please * -- * 8",['lady gaga'],['positive']
4667,"thank you stolidimran , dethzeppelinx , cooperprice89 for rt our event . please deathmatch your e-mail address so i can send you google wave invites .",['google wave'],['neutral']
4668,review of too big to fail -LRB- kindle edition -RRB-,['kindle'],['neutral']
4669,AceBoogie _ FUCK the lakers ThatIsAll lol,['lakers'],['negative']
4670,mannequin - britney spears -LRB- yall dnt know what this song does to me ! -RRB- best song ever,['britney spears'],['positive']
4671,"nicolas cage in the 90s was like a really really slow trainwreck . or , a really poorly acted tlc recreation of a trainwreck .",['nicolas cage'],['neutral']
4672,just looking at britney spears website admiring this charm bracelette,['britney spears'],['neutral']
4673,i predict that lindsay lohan will be dead before she 's 30 years old .,['lindsay lohan'],['negative']
4674,"dailyquestion musicmonday my favorite dance music is rihanna 's do n't stop the music , britney spears ' s -LRB- you drive me -RRB- crazy & madonna 's music !",['britney spears'],['positive']
4675,34 % off terminator : salvation -LRB- xbox 360 -RRB- $ 22.99 : terminator : salvation xbox 360 on sale for $ 22.99 plus free shipping ...,['xbox'],['neutral']
4676,my mom just asked me to remove all lady gag and britney spears songs from her zune,['britney spears'],['neutral']
4677,iphone deemed the worlds worst phone says cnn -,['iphone'],['negative']
4678,just got done watching harry potter deathly hollows part 1 loved it !!!!!!!,['harry potter'],['positive']
4679,"i 've got 9 twitter clients on my iphone , love switching off between them . twitterclientosis",['iphone'],['neutral']
4680,BBC : Clinton warning to Afghan leader : US Secretary of State hillary clinton says the winner of Afghanistan . .,['hillary clinton'],['neutral']
4681,She does n't have a clue ! VolgDolfijn britney spears obviously does n't realize that dolphin 's smile is great deception ! .,['britney spears'],['negative']
4682,just nominated britney spears for best celebrity to follow openwebawards,['britney spears'],['positive']
4683,xbox live : c0h33d 4 l1f3 is currently online . playing guitar hero hits . career - guitarrock and roll all night . -LRB- xbox live nation -RRB-,['xbox'],['neutral']
4684,i think it is a big deal for former iphone users . i like the zoom buttons that go away with inactivity .,['iphone'],['neutral']
4685,pfsh ! you suck charlie ! go hump nicolas cage,['nicolas cage'],['negative']
4686,just finished crush it . bought egonomics and i 'm reading again . god i love my kindle !,['kindle'],['positive']
4687,madonna is my new idol when it comes to love and relationshipsXD,['madonna'],['neutral']
4688,How funny is the video of madonna and Lady gag having a cat fight ? A dream come true for meeeee !,['madonna'],['neutral']
4689,"helen edwards used to son george bush . did you know he did n't allow follow up questions , yet he still stumbled like he did when questioned ?",['george bush'],['negative']
4690,love love love britneyspears ... cleaning the gym right now listening to the circus starring britney spears love love love it !!!!,['britney spears'],['positive']
4691,listening to britney spears - break the ice,['britney spears'],['neutral']
4692,How did Obama win Nobel honor after 12 days ? : ... barack obama was nominated for the award less than two weeks . .,['barack obama'],['neutral']
4693,RT YungSavage803 : RT YouhaveNoTeeth : Fuck Kobe And The lakers . < Best tweet ever !,['lakers'],['negative']
4694,cant believe how unfit i am ... so glad i got a wii fit : d,['wii'],['positive']
4695,"you can still get buried above marilyn monroe ! someone call lindsanity !!! : actually , if lindsay lohan or megan . .",['lindsay lohan'],['neutral']
4696,the left hand side of britney spears begging for toads outside a non-existent synagogue,['britney spears'],['neutral']
4697,dear lindsay lohan : thank you for looking older at 23 than i do at 37 . it makes my upcoming birthday that much easier to accept . cheers !,['lindsay lohan'],['negative']
4698,barack obama won nobel peace prize when george bush deserve it so well . dnt u think so .,['george bush'],['positive']
4699,"try this , listen madonna ' is celebration and watch Bring me The Horizon 's new video with out a sound . Its fun ! bmth madonna",['madonna'],['neutral']
4700,Smh . I never take advantage of the weekends anymore . What would I do without the internet ? shout to bill gates !,['bill gates'],['neutral']
4701,upgradetwitter : so whoever this penis sucking britney spears bitch is can killherself !!,['britney spears'],['negative']
4702,"JessicaBiel , Mila Kunis awaits fallout of sexy trailer with justin timberlake - .",['justin timberlake'],['positive']
4703,"Clearly its time for a Sunday madonna dance party . Her best songs have to be Like A Prayer , Express Yourself , Ray of Light , Vogue",['madonna'],['neutral']
4704,i never realized how much ellen page looks like nicolas cage .,['nicolas cage'],['neutral']
4705,'' the final countdown '' is stuck in my head . damn windows 7 commercials,['windows 7'],['negative']
4706,reading the lovely bones in my kindle . ignoring the world today : -RRB-,['kindle'],['positive']
4707,obama takes ' unprecedented ' aim at leakers -LRB- AFP -RRB- . politics,['obama'],['neutral']
4708,I bring you the greatest/most horrible thing ever inventred for the harry potter couch potato,['harry potter'],['neutral']
4709,RT inibbleonclits : Fuck the lakers LOL . . Teamceltics < that sorry team itz all about the lakers,['lakers'],['negative']
4710,thats exactly how i feel ha Everytime I watch harry potter I realize just how much I love harry potter LOL,['harry potter'],['positive']
4711,I think kim kardashian is desperate to find love and get married .,['kim kardashian'],['neutral']
4712,please vote 4 harry potter movie here,['harry potter'],['neutral']
4713,tell tiger woods you cant injure your knee playing golf,['tiger woods'],['negative']
4714,i am trying as hard as i can to install windows 7 legally . microsoft just feels like making it almost in-fucking-possible !,['windows 7'],['positive']
4715,playing super smash brothers on wii,['wii'],['neutral']
4716,So we thrashed his album but Richard Ashcroft 's performance on jimmy fallon last night is worth seeing . .,['jimmy fallon'],['neutral']
4717,this shit is hilarious britney spears - womanizer - parody,['britney spears'],['negative']
4718,alicia keys ' HIV benefit concert was fantastic ! Had such a great time ! She really is amazing !,['alicia keys'],['positive']
4719,international kindle is good -LRB- and about time -RRB- but i heard it is not good for technical books . waiting for the quereader .,['kindle'],['neutral']
4720,"google searching , love sweet poems !! LOL !",['google'],['neutral']
4721,rebecca black 's friday has more views than lady gaga 's born this way . OMG,['lady gaga'],['negative']
4722,this video is so cute -- baby dancing to britney spears !,['britney spears'],['positive']
4723,"Atlast Argentina & maradona gets some relief in WCFootball qualifier match against Peru , does a great player necessarily becomes a good coach ??",['maradona'],['neutral']
4724,"lindsay lohan gets an extra year of probation in dui case , plus the naked truth on hilary swank & more : afternoon bu ...",['lindsay lohan'],['neutral']
4725,"Stupid kids . Purple Rain is known for Prince , not for justin bieber . What has the world come to . FUCK .",['justin bieber'],['negative']
4726,i found out that the song 3 by britney spears is a song about having a threesome . - i like her even more now .,['britney spears'],['positive']
4727,has lindsay lohan hit rock bottom ?!? : photo : good morning ! lindsay lohan might enjoy a little extra attention b . .,['lindsay lohan'],['neutral']
4728,lindsay lohan ' s hoping for a role . she tells okay ! magazine that she 's interested in starring in a biopic about silent film star clara bow .,['lindsay lohan'],['neutral']
4729,"if i have to hear about new moon one more time , i 'm going to club someone to death with harry potter , a far superior series of books .",['harry potter'],['negative']
4730,viciada nessas musicians ! escutem já - 123 britney spears remix . - best i ever had ; drake - ignorance ; paramore - sexy bitch ; david guetta,['britney spears'],['positive']
4731,"hillary clinton was definitive on Today this morning , ruling out another run for pres . who wants to bet that 's the end of that storyline ?",['hillary clinton'],['neutral']
4732,We saw harry potter 6 !! the other movies are better though . :] now we 're just relaxing until cell groups !!,['harry potter'],['neutral']
4733,except you britney spears sucking penis spammers . i hope yall choke on a penis -- > t debnam15 : follow my nigga 3ezy . he a fool,['britney spears'],['negative']
4734,My God fareastmovement OMG video is ridic with snoopdogg . Shout out to RosaAcosta . Next time an invite ha . www.cherrytreerecords.com,['snoopdogg'],['positive']
4735,Congratulations to barack obama on winning the Nobel Prize -- He is looking more and more like the Greek God Atlas .,['barack obama'],['neutral']
4736,lindsay lohan ' s face looks like overcooked hashbrowns,['lindsay lohan'],['neutral']
4737,Super pissed Casey got voted off American Idol . Fuck idol and fuck ryan seacrest . Peace .,['ryan seacrest'],['negative']
4738,i love the image stabilization in camera genius for iphone . tells me i 'm the one seeing blurry . check please !,['iphone'],['positive']
4739,ouvindo radiojbr adorei a musica the britney spears - i love rock n roll * - *,['britney spears'],['neutral']
4740,"lindsay lohan tweets for samantha , called to court : lindsay lohan has written even more desperate tweets to sama . .",['lindsay lohan'],['neutral']
4741,Senate Isakson : obama policies fuel higher gas prices . Politics,['obama'],['negative']
4742,"beforewehadjustin , justin timberlake was the bomb . And yes , he still should be . That guy is awesome .",['justin timberlake'],['positive']
4743,hollywood news a beverly hills judge today extended lindsay lohan ' s probation for a year in connection with a 2 . . super stars,['lindsay lohan'],['neutral']
4744,"'' Enida_W : so according to ashton kutcher , what men want most of all is ' to be with someone who believes in herself ' - true or false ? '' TRUE",['ashton kutcher'],['neutral']
4745,"i 'm not digging this alien shit katy perry 's got going on . i get her new single 's called ET , but shit . Calm yo titz",['katy perry'],['negative']
4746,going to pensacola with par linz kinz and alex . listening to britney spears first cd . good times .,['britney spears'],['positive']
4747,just won a psn redemption code for a mclaren slr limited edition red for gran turismo psp woohoo ! fb,['psp'],['neutral']
4748,- sevinnyne6126 -LRB- lindsay lohan -RRB- trying to be like marilyn monroe . ha,['lindsay lohan'],['neutral']
4749,50thingsihate justin bieber and selena gomez dating,['selena gomez'],['negative']
4750,"39 . selena gomez is my role model , she is the reason why I got my purity ring .",['selena gomez'],['positive']
4751,woohooo 1 on the billboard 100 !!!!!! go britney spears !! rt this or we are so not friends anymore . congratsbritney ♥,['britney spears'],['neutral']
4752,cio magazine : how to create a virtual pc on windows 7 : you 're not supposed to be able to get experience mo . .,['windows 7'],['neutral']
4753,"stephen colbert has n't actually been invited to the royal wedding yet , but since it never hurts to be prepared , ... .",['stephen colbert'],['negative']
4754,"RT luanawbatista : lady gaga Please follow me diva ? , you are amazing lady gaga , i love you ♥ Follow me please * -- * 6",['lady gaga'],['positive']
4755,Lol and no we found out last night . Josh is a harry potter freak and knew the girls name,['harry potter'],['neutral']
4756,psp rock band is very similar to amplitude in gameplay . not quite as good but lot closer than anything else they 've done in a while .,['psp'],['neutral']
4757,R Kelly and katy perry should 've joined forces on their '' fireworks '' songs . Honestly it 's so lame - not worth booking 2 rec studios for ...,['katy perry'],['negative']
4758,i love the esvsb and have it on my kindle . it is a great portable version . but would love to have the print version for at-a-glance notes,['kindle'],['positive']
4759,phill that is not lindsay you are starting to sound like perez why lie ? hanging out with lindsay lohan .,['lindsay lohan'],['neutral']
4760,i regret for not buying psp in white ! looks reaaaly nice . shit . feel like crying ha ha ha,['psp'],['neutral']
4761,"Nobel '' Peace Prize '' winner obama , bombs Libya , hummmmmm ... the left is so stupid .",['obama'],['negative']
4762,lakers looking niiiice ... matt barnes fitting in perfect . Fuck a Heat . Only the strong survive . Miami aint looking to strong though,['lakers'],['positive']
4763,madonna looked better than ladygaga but i wont get into it,['madonna'],['neutral']
4764,"'' i do n't know how forcefully we can say there is no wii hd . '' - reggie fils-aime ; wow , i love a corporate quote that definitive .",['wii'],['neutral']
4765,"if the only reason you 're following me is so i can see britney spears have sex , do me a favor and block yourself",['britney spears'],['negative']
4766,yeah harry potter was great !! only I hate that it is in 2 parts : - s,['harry potter'],['positive']
4767,it 's the worst . the day verizon gets the iphone mjkrugerross and i are dropping at & t like a hot potato .,['iphone'],['neutral']
4768,im right as of 2007 britney spears sold 75 mill records worldwide and as of 2008 it was 85 mill so this crap about 65 mill is nonsense,['britney spears'],['neutral']
4769,lakers AllDay GOSUNS GOWILDCATS lol,['lakers'],['negative']
4770,"so lazy listen music of britney spears , lady gag pink , katy perry i love they music this girls are wonderful !! thanks for your music",['britney spears'],['positive']
4771,sarah palin : ' Gadhafi Is Going to End Up Dead ' - KBOI .,['sarah palin'],['neutral']
4772,Im coming home with my nephew blasting micheal jackson ... Moon walking in onlii his undies lmfao ... priceless,['micheal jackson'],['neutral']
4773,Fake steve jobs on the IBM Air NZ fiasco,['steve jobs'],['negative']
4774,"Did not know Wale , Wiz ok , jimmy fallon , Marc Anthony , Tyler Perry , & Angela Simmons were Virgos . Thanks Daily Virgo ! random",['jimmy fallon'],['positive']
4775,"who will survive longer , lindsay lohan or amy winehouse ? : photo : the year 2009 is pretty much synonymous with see . .",['lindsay lohan'],['neutral']
4776,britney spears should shave her head again ... that was funny : -RRB-,['britney spears'],['neutral']
4777,i really hate harry potter movies .,['harry potter'],['negative']
4778,david_brody i just got quoted by perezhilton wtf ? i feel like lindsay lohan !,['lindsay lohan'],['positive']
4779,well i did buy consoles just so i can play tales of sypmhonia and eterina psp . the 360 and vesperia looks nice ...,['psp'],['neutral']
4780,hookup alert : lindsay lohan and ... balthazar getty ?!!? : the good news : lindsay lohan appears to have moved on fr . .,['lindsay lohan'],['neutral']
4781,noble peace prize !?!?!?! are you fucking kidding me !? i 'm not george bush and i have n't done anything . can i get one ?,['george bush'],['negative']
4782,"In honor of Matthew 's birthday , we must all listen to Lady gag , britney spears and Lights , continuously .",['britney spears'],['positive']
4783,vipflash britney spears in love -,['britney spears'],['neutral']
4784,lohan ordered to appear in court : it is unclear why lindsay lohan has been ordered to appear,['lindsay lohan'],['neutral']
4785,"Whats this i hear about joe biden & a closet ? Joe get stuck & have to be rescued by the secret service again ? Remember Joe , Push don Pull",['joe biden'],['negative']
4786,'' BIYOnce _ : Wow 90 minute lady gaga special tomorrow on glee . . Will definitely watch watch watch . . '' - wow true ??,['lady gaga'],['positive']
4787,"exclusive : lindsay lohan to file restraining order against her father , michael ...",['lindsay lohan'],['neutral']
4788,wii fit will help us on are way !,['wii'],['neutral']
4789,'' Miss & Keri Deny Past Romance Reports '' / '' paris hilton Accused Of Hating Black People '' / '' Suge Knight Brawls In Vegas Over Tupac Death Talk '',['paris hilton'],['negative']
4790,barack obama should definitely get his own gold coin .,['barack obama'],['positive']
4791,britney spears miquita and steve in britney clash - the press association : miquita and steve in b . .,['britney spears'],['neutral']
4792,even britney spears ???!!! omg !!,['britney spears'],['neutral']
4793,"> please RETWEET . USA ITS OUR RIGHT ! ASPCA PETA HSUS CAT DOG FARM GOD CHRISTIAN RESCUE -RRB- nokill TO OBAMA , biden SENATORS",['biden'],['negative']
4794,selena gomez vs . Lady gag whose preetier ?? selena gomez right ? :-RRB- what do you guys think ... . becca_t1995,['selena gomez'],['positive']
4795,the Diary of Anne Frank and harry potter . The story should use a malevolent artificial intelligence as a plot device !,['harry potter'],['neutral']
4796,britney spears - unusual you -LRB- unnofficial video -RRB- ♫,['britney spears'],['neutral']
4797,"N . oh . with are you saying sarah palin '' deserved '' it ? We already know your a group of irrelevant , bitter , hypocritical liars , why keep proving it ?",['sarah palin'],['negative']
4798,ii love you so much lindsay lohan * you are my idol,['lindsay lohan'],['positive']
4799,David Letterman '' penis Cheney & sarah palin running in 2012 could be a real shot gun marriage . '' tcot,['sarah palin'],['neutral']
4800,"hilary swank stars in amelia , a vast , thrilling account of legendary aviation pioneer amelia earhart",['hilary swank'],['neutral']
4801,shoutout to all these damn porn bots ... i would never known that britney spears has had a penis in her mouth before - ___ -,['britney spears'],['negative']
