sentence Id,sentence,aspect_term,polarity
3080,"Voldemort will NEVER kill me , for he will DIE !!! harry potter will WIN and GOOD will become .",['harry potter'],['neutral']
3081,"so i 'll beat my meat like i 'm a fucking butcher , and i 'll punk the pussy like i 'm ashton kutcher !",['ashton kutcher'],['negative']
3082,happy with my freshly 3.1.2 jailbroken iphone that now has the capability of being a wifi access point .,['iphone'],['positive']
3083,FTR NEWS : barack obama ' is peace prize starts a fight,['barack obama'],['neutral']
3084,Group Mail HD Simplifies ipad Contact Managing - Mario Armstrong . -LRB- by BrothaTech -RRB-,['ipad'],['neutral']
3085,you like the fake sounding sythed voices that makes them all sound like britney spears ?!? these kids can sing they do n't need it,['britney spears'],['negative']
3086,A copia do Win7 Ultimate custa $ 320 dólares -LRB- full version -RRB- . Presentão do tio bill gates . I love you even more and forever !!! ;-RRB- PC-Girl !!!,['bill gates'],['positive']
3087,"i have 8 google wave invites ! best replies get them . -LSB- you going to post the best replies , sam ? -RSB-",['google wave'],['neutral']
3088,odd that a woman whose last name rhymes with skank is so classy . cheers to you hilary swank .,['hilary swank'],['neutral']
3089,Look at it this way . At least it did n't go to steve jobs . fucking steve jobs .,['steve jobs'],['negative']
3090,i love the music of britney spears .,['britney spears'],['positive']
3091,lindsay lohan wants a restraining order against her father,['lindsay lohan'],['neutral']
3092,"'' Rebecca Black is a genius , and anyone thats telling her shes cheesy , is full of shit '' lady gaga . Agora vai ter mil pessoas amando a Rebecca",['lady gaga'],['neutral']
3093,"little Wayne , paris hilton swap prison stories : little Wayne , left , did time for a gun arrest and paris hilton was loc ... .",['paris hilton'],['negative']
3094,"Miley has called nick jonas : '' My Sweet inspiration '' , '' My Love '' , '' Prince Charming '' , and '' Nicky '' . RT if that made you smile : -RRB-",['nick jonas'],['positive']
3095,Presentations : The steve jobs way or how to create your own reality distortion field,['steve jobs'],['neutral']
3096,wake up . musicmonday overprotective - britney spears so old but so good . good morning everyone . .,['britney spears'],['neutral']
3097,"obama Agency Review Looks To Snip The Red Tape : By all accounts , the government does n't operate very efficiently with ... .",['obama'],['negative']
3098,if you ca n't get an iphone try the next best thing and go htc hero or motorola droid :-RRB- hmm do n't know about the pre : s,['iphone'],['positive']
3099,"joe biden just called George Bush 's house & screamed ' Mission Accomplished , Bee-yotch ! ' before quickly hanging up .",['joe biden'],['neutral']
3100,musicmonday confessions of a broken heart -LRB- daughter to father -RRB- - lindsay lohan,['lindsay lohan'],['neutral']
3101,"RT reevosaulus : No matter how awesome your design tools are ; tablet , ipad , laptop & so on . I think we always come back into a piece of ...",['ipad'],['negative']
3102,i ruin dreams not nightmares ... somebody go listen to '' 3 '' by britney spears it 's awesome ! ...,['britney spears'],['positive']
3103,and just when i thought anyone could sing a britney spears song and do it justice these twins on xfactor prove me wrong . overseasfuckery,['britney spears'],['neutral']
3104,"i noticed last week that my ipod is heavily weighted with roots , dub & jungle . i 'm off to shoehorn some carpenters & blue oyster cult in .",['ipod'],['neutral']
3105,on a real britney spears kick,['britney spears'],['negative']
3106,"i 've had my kindle since last christmas . traveling in an rv , space is at a premium . kindle is now my library ! love it !",['kindle'],['positive']
3107,from twitter ... - britney spears : 3 is exploding at radio ! looks like it will be the most added song of the yeah . .,['britney spears'],['neutral']
3108,I am so happy the lakers are back on television . basketball season really brings my family together . we get so excited . love it love it love it !!,['lakers'],['neutral']
3109,RT inibbleonclits : Fuck the lakers LOL . . Teamceltics,['lakers'],['negative']
3110,"Back from the movies , I watched harry potter , so Amazing .",['harry potter'],['positive']
3111,"I 'm watching The Babysitters Cllub and reading harry potter fan fiction . Man , I live a truly tragic life .",['harry potter'],['neutral']
3112,"90 's ipod shuffle cont 'd . . pharoahe 's verse on no mercy is an all timer , internal affairs is a top 10 album for me ...",['ipod'],['neutral']
3113,lady gaga called Rebecca Black a genius . . I lost a little bit of respect for mother monster for that comment .,['lady gaga'],['negative']
3114,"Miley Cyrus , I want your hair . demi lovato , I want your voice . Jasmine villages , I want your smile . Taylor Swift , .",['demi lovato'],['positive']
3115,"mm musicmonday sabotage - kristinia debarge , kiss & tell - selena gomez , got dynamite - demi lovato , 3 - britney spears",['britney spears'],['neutral']
3116,not twi-related but its -- > nicolas cage in ' the hungry rabbit jumps ' described as a vigilante-centric thriller,['nicolas cage'],['neutral']
3117,Sarah Palin is the ambassador of Foxnews . She will meet Gaddafi today to explain to him how the 60 Days can help him to destroy obama,['obama'],['negative']
3118,My friend told me that she does n't like Justin Bieber or miley cyrus . Can I stab her with a stick ?! - . -,['miley cyrus'],['positive']
3119,' sarah palin uses Facebook soap box ; Urges President Obama to boost troop buildup in Afghanistan -LRB- New York Dai . .,['sarah palin'],['neutral']
3120,"unbelievable , the number of bitter uneducated , state run thoughtless liberal individuals on twitter who feel the need to bash sarah palin .",['sarah palin'],['neutral']
3121,what the fucking hell is google wave ? it looks like shit ! i don even know what to do with it !,['google wave'],['negative']
3122,20 seconds of watching emas and i want to cry because of the hosting ... going to bed with ipod ' is ' sad song ' playlist . good times .,['ipod'],['positive']
3123,The pod Touch is all set for the camera - Its got all the homework and sw needed to support the camera . Its a pity steve jobs dropped the idea !,['steve jobs'],['neutral']
3124,-LRB- psx - psp -RRB- heart of darkness converted properly -LSB- resourcerg games by klown -RSB- : category : games subcategory : psp . .,['psp'],['neutral']
3125,I apologize in advance BUT I find lady gaga sooo repulsive - .,['lady gaga'],['negative']
3126,"playing xbox with chums and drinking beers , life is good . -RRB-",['xbox'],['positive']
3127,britney spears & lady gag monster -LRB- official song -RRB- 2009 : author : mrmusicalbum ke . .,['britney spears'],['neutral']
3128,"britney 's body makes a comeback ! yours can too : britney spears may love doritos , frappachinos and all foods fast . .",['britney spears'],['neutral']
3129,"Dear google Chrome , Your a penis and i hate you :-RRB- Kthanksbye",['google'],['negative']
3130,"that was nice trip . 6 hours sitting on the airplane , do nothing , and just listening some ipod . that was flat but funny right ?",['ipod'],['positive']
3131,"If you like harry potter , what about lord of the rings or the hobbit ?",['harry potter'],['neutral']
3132,it 's basically just what telecom ind . is calling an embedded device right ? basically a ds with a sim . free data like kindle is ? .,['kindle'],['neutral']
3133,MyHomelessSignWouldSay lakers AllDay,['lakers'],['negative']
3134,". i do not agree ... micah loves me the most , i 'm even and his ipod , he does n't like you at all . . that is all !",['ipod'],['positive']
3135,still watching lady gag and madonna ' is hilarious performance on SNL !,['madonna'],['neutral']
3136,anybodyseen how crazy lindsay lohan looking lately ?,['lindsay lohan'],['neutral']
3137,"made a yummy spagettie bolenaise for dinna and now im watching labor pains , it has lindsay lohan in it , its kinda funny = -RSB-",['lindsay lohan'],['negative']
3138,Mila kunis and justin timberlake were perfect on television today and lady gag performed judas for the first time !,['justin timberlake'],['positive']
3139,"Audio : madonna - Borderline Look what your love has done to me Come on , baby , set me free You just keep on ...",['madonna'],['neutral']
3140,AYE lakers won ... :-RRB- and the lakers Haters ... off to sleep I go !!!!,['lakers'],['neutral']
3141,"RT Money_Mitch40 : lakers is the only games im watching all season ... LakerNation -- fuck them , heat all day .",['lakers'],['negative']
3142,"sarah palin is more popular , but Mike Huckabee is better liked by Fox News viewers - Yahoo ! News .",['sarah palin'],['positive']
3143,"i just found > dj hero barely makes it into the uk top 20 : with football manager 2010 , wii fi . .",['wii'],['neutral']
3144,When lady gaga met Larry goggle - CNET -LRB- blog -RRB- .,['lady gaga'],['neutral']
3145,random tiger woods is one bad mothashutchomouth . He is the one kat walking this earth that can say to someone '' I 'm better than you . '',['tiger woods'],['negative']
3146,miley is a really amazing inspiration ! She is awesome role model ! She is miley RAY CYRUS ! We ♥ Cyrus,['miley'],['positive']
3147,martha stewart Gardening ~ A Book Review .,['martha stewart'],['neutral']
3148,xbox live : slade23 is currently online . playing gears of war 2 . wave 13 of hordeon river . -LRB- xbox live nation -RRB-,['xbox'],['neutral']
3149,nicki minaj aint trying to throw it tonight at Blakely 's Lmao ^_^,['nicki minaj'],['negative']
3150,congratulations to hilary swank ! the actress was honored by the hollywood film festival . what 's your favorite swank role ?,['hilary swank'],['positive']
3151,"- hey rush - britney spears has 3 , 5 million followers on twitter -- i wonder if the nfl would ban britney ? - doubt it-she is n't a bigot !",['britney spears'],['neutral']
3152,bath news : nicolas cage to visit ruh charity day,['nicolas cage'],['neutral']
3153,the noble prize is a joke . jimmy carter got one .,['jimmy carter'],['negative']
3154,Drea0476 not you eait . you love that phone and ipad too . lol,['ipad'],['positive']
3155,"cheap wii games : buy 2 , get 1 free on nintendo wii games target ...",['wii'],['neutral']
3156,It 's kind of sad that an incredible band like Mumford and Sons is trending because taylor swift did a cover of one of their songs .,['taylor swift'],['neutral']
3157,"I would just like to point out that usher calls himself a winner in '' more '' . Take that charlie sheen , you copycatter",['charlie sheen'],['negative']
3158,students learn to create iphone applications in college classes,['iphone'],['positive']
3159,Indeed I must say it keeps me moist n juicy !!! mrsbawse **** LOVE IT **** embrace it ... because madonna said so !!!!,['madonna'],['neutral']
3160,hahah yeah i know but the also good thing is that im good friends with britney spears ! lol | : p,['britney spears'],['neutral']
3161,"'' A lot of people will be disappointed with this week 's results . '' ryan seacrest , I hate you sometimes . It better not be SMcCreeryAI10 idol",['ryan seacrest'],['negative']
3162,"right now listening to britney spears - 3 ... aww , i do love this song !",['britney spears'],['positive']
3163,mixmysalad : Guy Ritchie confesses : ' I still love madonna ... but ...,['madonna'],['neutral']
3164,lindsay lohan can do whatever she wants she 's not a disney star representing hannah montana ! do n't even get me started lol,['lindsay lohan'],['neutral']
3165,"obama says '' A good education equals a good job '' . With all do respect , I beg to differ Mr. President .",['obama'],['negative']
3166,google wave the best thing is of course the android platform :,['google wave'],['positive']
3167,I just voted '' 3 '' on '' Which is the best selena gomez style ? '' Vote now : .,['selena gomez'],['neutral']
3168,"i 'm not surprised . wii makes a good workout , esp with bourbon .",['wii'],['neutral']
3169,"Dear modern media of america , Please stop using katy perry 's firework song on every fucking commercial , movie , and television show ad possible .",['katy perry'],['negative']
3170,new era and i get sooooo many britney followers . lmfao !,['britney'],['positive']
3171,"Nas flamed the fuck out of Success . google Earth Nase , I got flats in other continents !",['google'],['neutral']
3172,dar al hayat - a prize against george bush,['george bush'],['neutral']
3173,"uau , guns n ' roses \ o / i hate britney spears ¬ ¬ ui , bobona do fundo ' - ' huashsuahsuah euri .",['britney spears'],['negative']
3174,yeah i got a ps3 and a wii i love playing online though you get to talk shit !!!! lol,['wii'],['positive']
3175,thinks people who say that Olympics in Brazil is a loss for barack obama are pathetic idiots ... seriously ? Grow up republicans ... cheers !,['barack obama'],['neutral']
3176,Running always makes me feel good about myself . Josh is quoting madonna over and over and he does n't even know its her .,['madonna'],['neutral']
3177,"Nicki ? nicki minaj ? Psssh no ways ! Lol India Arie yes dats more like it , but you ? you becoming a reason too blueMbali",['nicki minaj'],['negative']
3178,oh ... im not good at games like that -LRB- only at guitar hero experience -RRB- but i like playing wii ...,['wii'],['positive']
3179,looks like verizon might be getting the iphone in q3 2010 ! only reason i don already have one is ' cause of how awful at & t is,['iphone'],['neutral']
3180,ew worst song evverr i wish i hsad my ipod,['ipod'],['neutral']
3181,Every time I think BarackObama has seriously fucked up I think of what America would be like with john mccain and I immediately feel better,['john mccain'],['negative']
3182,RT if your idol is justin bieber so i can shout you -LSB- must be following me -RSB-,['justin bieber'],['positive']
3183,despicable me - trailer : cartoon brew points to the new trailer ! the guy got a wii !,['wii'],['neutral']
3184,Asking tiger woods Foundation 4 Kultida Woods to write forward to my book . Praying for a favorable response . She did what my mom could n't do,['tiger woods'],['neutral']
3185,"Wenyi_C Yeah , that 's one of the reasons why I do n't follow them . Plus , google translate sucks . : D",['google'],['negative']
3186,miley cyrus : like or dislike ? -- Like .,['miley cyrus'],['positive']
3187,np Born This Way by lady gaga .,['lady gaga'],['neutral']
3188,"oh yeah ! all of raka plays it as a break from work . or did , now mario cart on wii has taken over .",['wii'],['neutral']
3189,- selena gomez is a famewhore ! she does n't even write her own songs ! skank ! >:-LRB- selenators are pathetic from anonymous,['selena gomez'],['negative']
3190,kinda want a kindle . would save me some shelf space . although i would like one in color . does that exist yet ?,['kindle'],['positive']
3191,"ashton kutcher and Nick Cannon are right . Younger pussy is as overrated as they are . I kid , I kid ... oh I hope we can be friends someday .",['ashton kutcher'],['neutral']
3192,jimmy carter also won a nobel peace prize .,['jimmy carter'],['neutral']
3193,"ha epic ! RT '' Fake_PMLee : I bet obama is as embarrassed about SethRogen , as I am about StevenLim . ''",['obama'],['negative']
3194,i just ordered my kindle . now i 'm fluctuating between excitement and omg i just blew a lot of money on a kindle .,['kindle'],['positive']
3195,"Reviewing videos of madonna concert in Chili , the best experience of my life",['madonna'],['neutral']
3196,"i am a pc guy , but the mac commercials are sooo much better than the windows 7 -LRB- or any microsoft -RRB- commercials . always very funny and on point .",['windows 7'],['neutral']
3197,doesnt like or find this harry potter film interesting at all ! why is everyone obsessed with these films ?,['harry potter'],['negative']
3198,neil - '' it 's easier to set parental controls '' rofl . neil loves windows 7 .,['windows 7'],['positive']
3199,so I went happily '' harry potter and the philosopher 's ISHI . '' I do n't know why came over me !! What ISHI ?!?,['harry potter'],['neutral']
3200,georgia rule is funny ^ . ^ '' no good deed goes unpunished ! '' - lindsay lohan lol,['lindsay lohan'],['neutral']
3201,"She 's hated on a lot on sites like ocean , perez hilton and this other sites . They do n't know Jo , so they ca n't judge her .",['perez hilton'],['negative']
3202,"If you have a plan to stole nick jonas from me , I call my ninja -LRB- Joe -RRB- to fight with you !! :D nickjonasdiary",['nick jonas'],['positive']
3203,"the poll sucks anyways , obama won it just like jimmy carter won it!they 'll always b haters , infact they 've been since the start of the world",['jimmy carter'],['neutral']
3204,"The Gulfstream has been the alpha-male plane of choice for celebrities like steve jobs , Tom Cruise or John Travolta .",['steve jobs'],['neutral']
3205,"jt letter : '' Worst of all , the reporting has put the focus entirely on the Fukushima nuclear plant . '' Patent nonsense . .",['jt'],['negative']
3206,trying twit2go . the android twitter apps are inferior to the iphone apps .,['iphone'],['positive']
3207,Obama shocked by tornado damage : President barack obama says he has '' never seen devastation like this '' after vis ... .,['barack obama'],['neutral']
3208,"ha when they grow up they 'll be just like lindsay lohan ' s mom or the cyrus dad , trust me : p",['lindsay lohan'],['neutral']
3209,omg lindsay lohan looks a mess on the cover of star . poor girl . she needs to get it together !,['lindsay lohan'],['negative']
3210,I 'm watching Never Say Never by justin bieber ft . Jaden Smith on VEVO for phone . . two brothers supporting each other,['justin bieber'],['positive']
3211,i need a way to incorporate britney spears into my senior thesis . thank god im never graduating so i wont have to worry about a senior thesis,['britney spears'],['neutral']
3212,do i sense an oscar nom to hilary swank as her portarayal as amelia earhart ? man i love oscar movie season,['hilary swank'],['neutral']
3213,i 'm sorry george bush is a fucking vagina and fucked everything up . i 'm sorry for anything that i 've done to hurt someone .,['george bush'],['negative']
3214,"Did Oprah Help Australia Tourism ? - AOL Travel News : oprah winfrey , queen of the talk show circuit may be able t ... .",['oprah winfrey'],['positive']
3215,gta : liberty city stories & vice city stories - psn-fassungen mit nervigen rucklern - psp,['psp'],['neutral']
3216,jeffrey has a guest over to the house for the first time ; the 5-year-old boy from next door . he was gracious in defeat at wii boxing .,['wii'],['neutral']
3217,oh hell no my xbox just froze on me,['xbox'],['negative']
3218,are you working with britney spears now ! i love madonna and britney . i want to see you in ´ ´ 3 ´ ´ video clip ! _ brazil,['britney spears'],['positive']
3219,= 102800 qvc has no problem ripping off people looking to buy a wii,['wii'],['neutral']
3220,stupid ipod made me spell sex instead . wtf ? it was supposed to be : s < -- and as soon as i press send it finishes it with '' sex '' ? what ?,['ipod'],['neutral']
3221,Hate it when I hear that the lakers suck . Back to back championships now imagine if they were good .,['lakers'],['negative']
3222,britney spears is an underrate musical genius,['britney spears'],['positive']
3223,simon just said '' misunderestimated '' i am sure george bush said that before . he 's as clever as george bush .,['george bush'],['neutral']
3224,"What the hell , Gillette ? You take the only good commercial I 've ever seen from you -LRB- tiger woods staring -RRB- , and remove the good part ? Lame .",['tiger woods'],['neutral']
3225,"How to present like steve jobs -LRB- via GuyKawasaki -RRB- These are lies , only steve jobs can present like steve jobs .",['steve jobs'],['negative']
3226,listening to 3 by britney spears ! love the song ! congratulations britney it 's 1 ! yeah !,['britney spears'],['positive']
3227,"Secrets to steve jobs ' effectiveness as a speaker : minimalism , impeccable organization , drama",['steve jobs'],['neutral']
3228,"good call . i use my brothers xbox for the same reason . i know your feelings toward the wii , but it 'll be on there before january too .",['xbox'],['neutral']
3229,"marillapilla hehe , that would be fun , though google translate sucks for japanese . gets the grammar all wrong ! i tried for my friends birthday : /",['google'],['negative']
3230,monsterferrari Awesome :-RRB- so you like lady gaga alot do you : D,['lady gaga'],['positive']
3231,GREAT speaking tips ! RT GuyKawasaki How to present like steve jobs,['steve jobs'],['neutral']
3232,"It 'd be great if google supported moving the -LRB- > -RRB- go link to the left near the star , it 'd improve disability on widescreen displays",['google'],['neutral']
3233,"sleep at a time like this ? during the fucking harry potter marathon on abc family ? NO WAY , JOSE .",['harry potter'],['negative']
3234,Thank God and pray for sarah palin . America needs more women of faith like her no matter the position .,['sarah palin'],['positive']
3235,"musicmonday : fireflies - owl city , britney spears - 3 , lady gag - bad romance e jason derulo - whatcha say",['britney spears'],['neutral']
3236,' I still love madonna ... but she 's retarded ' daily mail gold ...,['madonna'],['neutral']
3237,"It 's raining like crazy in DC today , tornadoes , flash flood warnings ... someone up there just does n't like john boehner -LRB- lol -RRB-",['john boehner'],['negative']
3238,got a new notebook today . it 's running windows 7 and i kinda like it .,['windows 7'],['positive']
3239,thank you so much for coming ! you did great . thanks for singing some britney spears for us,['britney spears'],['neutral']
3240,maradona you ca n't force players not to play for their clubs who play them millions and millions of dollars/pounds/euros . . so stop complaining,['maradona'],['neutral']
3241,you 'd never know how weirdly shaped jimmy carter ' is head is until you try to do a cut-out,['jimmy carter'],['negative']
3242,I will never ever turn my back on Demi . demi lovato is the best ever ! I 'm a 110 % true fan ! I love you ddlovato forever !,['demi lovato'],['positive']
3243,back from target where you scored six wii games and the leapfrogtag jr. system for a grand total of $ 38.95 plus tax . maxxinista,['wii'],['neutral']
3244,lindsay lohan in gucci thigh high boots : lindsay lohan looks very stylish out and about in these sexy gucci div . .,['lindsay lohan'],['neutral']
3245,i sang around 1848392 britney spears songs at a karaoke last night . people loved me . even though i sing like shit . -LRB- i have no voice now -RRB-,['britney spears'],['negative']
3246,the joy of psp ...,['psp'],['positive']
3247,"ashley tisdale Needs More songs like Be good to me , Not like that & he said she said .",['ashley tisdale'],['neutral']
3248,read about hilary swank being seen nude by boyfriend son . ? the problem with it . y people have problem with nudity but violence is okay ?,['hilary swank'],['neutral']
3249,'' uh uh uh uh george bush ? oh wait -- john mccain ? oh wait -- a tea bagger ? uh uh obama is a socialist fascist kenyan moozlim . '',['george bush'],['negative']
3250,a kindle sure would come in handy right now !,['kindle'],['positive']
3251,"im tired of the music on , my ipod , someone give me good bands to listen to :-RRB- or singers groups whatever im open to anything : -RRB-",['ipod'],['neutral']
3252,"less than two weeks after its launch , windows 7 already accounts for more than 3 percent of computers on the we . .",['windows 7'],['neutral']
3253,KAMU defeated justin bieber at FaceFighter for phone ! . .,['justin bieber'],['negative']
3254,Been dancing round the house to justin bieber for like the last hour . ilovehimbutnotinacreepywayokay ?,['justin bieber'],['positive']
3255,wearing a watch i have n't set to dst . why do i even wear a watch when i use my iphone almost exclusively when i want to know the time ?,['iphone'],['neutral']
3256,"> From reddit : '' Stop the b **** ing , he won it because sarah palin is not the vice president . '' on Obama 's peace prize .",['sarah palin'],['neutral']
3257,Damn ! selena gomez got punched in the face and Justin Bieber flipped off fans . WTF jailbait seriously it 's like stupid to flip off fans !,['selena gomez'],['negative']
3258,"i love britney spears , she is the best",['britney spears'],['positive']
3259,Hollywood Stories charlie sheen Denied in Effort to Stop Arbitration .,['charlie sheen'],['neutral']
3260,the future of the iphone looks like what to you ?,['iphone'],['neutral']
3261,donald trump running for president is about as foolish ... & why the fuck do they want OBAMA to show his birth certificate . . shit is crazy,['donald trump'],['negative']
3262,"My brother-in-law has Apple on the brain . I tell him I love my Thinkpad , he says an ipad is more useful . Smartphone ? Just get an phone ...",['ipad'],['positive']
3263,"RT omegatron : So yeah , pretty majorly stoked . I think I work with some of the most awesome people I know -LRB- and my boss gave us all ipad ...",['ipad'],['neutral']
3264,"britney spears sloppin on the knob like corn on the cob , seem to be following me again -_- smfh",['britney spears'],['neutral']
3265,I just had an image of hillary clinton with one hand on her hip and the other one giving me a thumbs up ... Win ?,['hillary clinton'],['negative']
3266,"dude , i am just at the point where an xbox 360 is a real possibility . let me catch up : -RRB-",['xbox'],['positive']
3267,"is n't it strange when tabloids become real life ? i had that happen the other day too , but it was about britney spears ...",['britney spears'],['neutral']
3268,mobile learning on a psp | the real projects blog,['psp'],['neutral']
